{
    "schema_version": "2.0.0",
    "vehicle_id": 1,
    "ts": "2026-04-16T08:51:04.522Z",
    "seq": 2266,
    "battery": {
        "pack_v": 63.2,
        "pack_current_a": 0,
        "soc": 93.2,
        "soc_bms": 74,
        "max_disch_a": 100,
        "cell_count": 19,
        "cell_avg_mv": 3327,
        "cell_min_mv": 3325,
        "cell_max_mv": 3330,
        "cell_spread_mv": 5,
        "cells_voltages": [
            3328,
            3329,
            3329,
            3329,
            3329,
            3329,
            3329,
            3328,
            3329,
            3329,
            3329,
            3330,
            3329,
            3329,
            3325,
            3326,
            3326,
            3326,
            3325
        ],
        "charge_limit": {
            "max_charge_v": 69.3,
            "max_charge_a": 35,
            "enable": true
        },
        "status": {
            "fault_level": 0,
            "error_code": 0,
            "ready": true,
            "charging": false,
            "discharging": false
        }
    },
    "temperatures": {
        "battery_avg_c": 20.5,
        "battery_min_c": 20,
        "battery_max_c": 21,
        "battery_temps_c": [
            20,
            20,
            21,
            21
        ],
        "dcdc_temp_c": null,
        "motor_temp_c": null,
        "mppt_temp_c": null
    },
    "solar": {
        "pre_mppt": {
            "voltage_v": null,
            "current_a": null
        },
        "post_mppt": {
            "current_a": null
        }
    },
    "dc_dc": {
        "output_64v": {
            "voltage_v": null
        },
        "output_12v": {
            "voltage_v": null
        }
    },
    "gnss": {
        "lat": null,
        "lon": null,
        "alt_m": null,
        "speed_kmh": null,
        "fix": false
    },
    "vehicle": {
        "handbrake": true
    }
}